{"schema_version":"genshin-world-lore-card-v1","lore_id":"magic_pocket_realms","name_zh":"洞天、秘境与人工子空间","name_en":"Pocket Realms and Sub-Spaces","aliases":["洞天、秘境与人工子空间","Pocket Realms and Sub-Spaces"],"category":"technology","scope":"cross_regional","regions":[],"summary":"现有证据确认了数种彼此独立的特殊空间：外景能够创造小型、自主的口袋世界；「诀箓阴阳寮」是结合仙法与神通建造的演武秘境；「琉形蜃境」是位于瓶中的秘境；希穆兰卡则是由三名 Hexenzirkel 成员创造的世界。证据尚未证明这些空间属于统一分类、采用同一原理或存在技术传承关系。","canonical_facts":[{"fact_id":"magic_pocket_realms_fact_001","text":"外景（Sub-Space Creation、Waijing）是一种能够创造小型、自主口袋世界的能力；Fandom资料还将其描述为通过想象创造空间的仙家能力。","status":"confirmed","temporal_scope":"长期有效；至少在相关任务发生时仍有人掌握","visibility":"specialist_knowledge","source_ids":["fandom_magic_pocket_realms","fandom_sup_magic_pocket_realms_01"]},{"fact_id":"magic_pocket_realms_fact_002","text":"Madame Ping称外景是 Rex Lapis 曾经赐予他们的一项祝福；旅行者此前进入的茶壶小世界就是以这种能力制成的器物。","status":"reported","temporal_scope":"祝福赐下于过去；茶壶在相关任务发生前已经制成","visibility":"specialist_knowledge","source_ids":["fandom_sup_magic_pocket_realms_01"]},{"fact_id":"magic_pocket_realms_fact_003","text":"以外景制造的壶中空间并不等同于完整的真实世界；Serenitea Pot 无法容纳一整座城市。","status":"confirmed","temporal_scope":"能力限制，长期有效","visibility":"specialist_knowledge","source_ids":["fandom_magic_pocket_realms"]},{"fact_id":"magic_pocket_realms_fact_004","text":"外景能量能够使物品具有不同于提瓦特常态的性质，例如让土壤长期保持养分、使池水与温泉维持适宜状态，以及让颜料承载与旅行者共鸣的记忆。","status":"confirmed","temporal_scope":"能力性质，长期有效","visibility":"specialist_knowledge","source_ids":["fandom_magic_pocket_realms"]},{"fact_id":"magic_pocket_realms_fact_005","text":"外景并非无所不能：它无法复现某种已经灭绝的花的原初形态。","status":"confirmed","temporal_scope":"能力限制，长期有效","visibility":"specialist_knowledge","source_ids":["fandom_magic_pocket_realms"]},{"fact_id":"magic_pocket_realms_fact_006","text":"「诀箓阴阳寮」是一座由惟神晴之介创造的秘境；式大将也由他创造，并担任寮司。","status":"confirmed","temporal_scope":"阴阳寮建立后","visibility":"restricted_knowledge","source_ids":["local_sup_magic_pocket_realms_01","local_sup_magic_pocket_realms_03"]},{"fact_id":"magic_pocket_realms_fact_007","text":"惟神晴之介在故国遭受灾害、失去珍视之人后前往璃月寻访仙人并修习仙法，将仙法与自己多年研习的「神通」结合，缔造最早的「阴阳术」；他随后创造式大将与阴阳寮，用于训练武士对抗魔物。","status":"reported","temporal_scope":"诀箓阴阳寮建立时期","visibility":"secret_or_exceptional","source_ids":["local_sup_magic_pocket_realms_03"]},{"fact_id":"magic_pocket_realms_fact_008","text":"昔日与武士搭档的式神会拓写战败魔物的信息；返回阴阳寮后，这些信息会以「镜返魔物」的姿态重现，充当训练对手。式大将则吸收各拓本的见闻与经验，并调整秘境架构。","status":"confirmed","temporal_scope":"诀箓阴阳寮作为训练场运作期间","visibility":"restricted_knowledge","source_ids":["local_sup_magic_pocket_realms_03"]},{"fact_id":"magic_pocket_realms_fact_009","text":"惟神晴之介后来遣散所有武士并废弃阴阳寮，原因在现有证据中没有补全。阴阳寮与式大将沉睡多年后，又在某种未知力量影响下复苏魔物并打开大门。","status":"confirmed","temporal_scope":"阴阳寮废弃后至重新开启时","visibility":"secret_or_exceptional","source_ids":["local_sup_magic_pocket_realms_01","local_sup_magic_pocket_realms_03"]},{"fact_id":"magic_pocket_realms_fact_010","text":"导致诀箓阴阳寮异常复苏并自行开启大门的力量究竟是什么，现有证据没有确定。","status":"unknown","temporal_scope":"诀箓阴阳寮重新开启时","visibility":"secret_or_exceptional","source_ids":["local_sup_magic_pocket_realms_01"]},{"fact_id":"magic_pocket_realms_fact_011","text":"「琉形蜃境」（Veluriyam Mirage）是一处位于小玻璃瓶内部的秘境，其中具有多个区域和特殊的水元素生命；触摸相应瓶子能够进入其中。","status":"confirmed","temporal_scope":"琉形蜃境存在期间","visibility":"secret_or_exceptional","source_ids":["fandom_sup_magic_pocket_realms_05","local_sup_magic_pocket_realms_04"]},{"fact_id":"magic_pocket_realms_fact_012","text":"琉形蜃境依靠核心维持运转。核心丢失部分零件后，周边区域受到连锁影响，蜃境中的许多事物停止运作，并出现逐渐崩塌的迹象。","status":"confirmed","temporal_scope":"相关事件开始阶段","visibility":"restricted_knowledge","source_ids":["local_sup_magic_pocket_realms_04"]},{"fact_id":"magic_pocket_realms_fact_013","text":"希穆兰卡（Simulanka）是由 Alice、Barbeloth 与 Andersdotter 三名 Hexenzirkel 成员创造的世界；希穆兰卡居民分别将她们视为创造、预言与命运的女神。","status":"confirmed","temporal_scope":"希穆兰卡被创造后","visibility":"secret_or_exceptional","source_ids":["fandom_sup_magic_pocket_realms_06"]}],"timeline":[{"period":"过去某时","order_hint":10,"events":["Rex Lapis 将外景作为祝福的一部分赐予包括 Madame Ping 在内的人。"],"current_status":"至少在相关任务发生时，Madame Ping 的外景能力尚未衰退。","source_ids":["fandom_sup_magic_pocket_realms_01"]},{"period":"故国遭受灾害之后","order_hint":20,"events":["惟神晴之介前往璃月修习仙法，并将其与自身神通结合，缔造最早的阴阳术。","他随后创造式大将与诀箓阴阳寮，将其用作训练武士对抗魔物的演武秘境。"],"current_status":"阴阳寮后来被废弃，原有训练体系终止。","source_ids":["local_sup_magic_pocket_realms_03"]},{"period":"阴阳寮运作后期","order_hint":30,"events":["惟神晴之介遣散所有武士并废弃整座秘境，其离去原因及临行前对式大将所说的话没有被恢复。"],"current_status":"式大将与阴阳寮随后沉睡多年。","source_ids":["local_sup_magic_pocket_realms_03"]},{"period":"阴阳寮沉睡多年后","order_hint":40,"events":["某种未知力量影响诀箓阴阳寮，使魔物复苏并令大门开启。","式大将在失忆状态下苏醒，后来恢复大部分记忆并决定重新掌控秘境。"],"current_status":"截至所引对话，式大将仍在寻找最后的拓本；后续最终状态没有由本证据包确定。","source_ids":["local_sup_magic_pocket_realms_01","local_sup_magic_pocket_realms_03"]},{"period":"琉形蜃境相关事件开始阶段","order_hint":50,"events":["支持琉形蜃境运转的核心丢失部分零件，导致周边区域受损，许多事物停止运行。"],"current_status":"截至所引对话，伊迪娅等人正准备解决故障；最终修复状态没有由本证据包确定。","source_ids":["local_sup_magic_pocket_realms_04"]},{"period":"希穆兰卡建立时期不详","order_hint":60,"events":["Alice、Barbeloth 与 Andersdotter 创造了希穆兰卡世界。"],"current_status":"所引资料将其描述为拥有居民与多个区域的完整世界；其后续状态没有由本证据包确定。","source_ids":["fandom_sup_magic_pocket_realms_06"]}],"relationships":[],"in_world_visibility":{"public_summary":"「秘境」作为地点概念能被冒险者和旅人识别，但不同特殊空间的创造原理、控制方式与历史通常只被创造者、管理者、内部居民或亲历者掌握。","likely_known_by":["掌握外景的相关人士，如 Madame Ping","惟神晴之介、式大将以及昔日参与阴阳寮训练的武士与式神","伊迪娅及进入过琉形蜃境的旅人","Alice、Barbeloth、Andersdotter以及希穆兰卡居民"],"unlikely_known_by":["从未接触相关空间的一般居民","不了解仙法、阴阳术或相应空间内部历史的人"],"common_beliefs_or_misconceptions":["有关沙漠中央瓶中秘境能满足进入者心愿的传闻，其真实性在材料中受到质疑。","伊迪娅曾把稻妻的阴阳寮描述成设有甲乙丙丁班级、按测试分配式神力量的培训学院；这一说法与式大将恢复记忆后所述的武士演武训练场历史不一致。"]},"activation_keys":["洞天、秘境与人工子空间","Pocket Realms and Sub-Spaces"],"excluded_material":{"gameplay_only":["秘境的奖励、树脂消耗、冒险等阶、解锁条件、传送功能、地图图标、联机与观战规则。","常设、一次性、任务及活动秘境中仅用于组织玩法的挑战与奖励分类。","琉形蜃境与希穆兰卡的版本期限、区域解锁步骤、收集物、宝箱、谜题、移动机关、战斗玩法及相关操作说明。","各区域的游戏内配乐播放列表与活动界面信息。"],"unsupported_or_speculative":["Fandom关于 Onmyoudou 制成的器具与外景可能有关的推测，未被材料确认为共同原理或技术传承。","Chubby关于外景能量可能使断尾再生为完整蜥蜴的说法明确未经试验。","希穆兰卡名称来源于“simulation”与“Lanka”的词源猜测。"]},"sources":[{"source_id":"fandom_magic_pocket_realms","provider":"fandom","role":"primary","title":"Sub-Space Creation","url":"https://genshin-impact.fandom.com/wiki/Sub-Space_Creation","language":"en","revision_id":"2052492","source_text_sha256":"c84eeb2a3bc1f8fdcd64557439af75ea39322a4f9889716dd9442c2dda35dffd"},{"source_id":"fandom_sup_magic_pocket_realms_01","provider":"fandom","role":"primary","title":"A Teapot to Call Home: Part I","url":"https://genshin-impact.fandom.com/wiki/A_Teapot_to_Call_Home%3A_Part_I","language":"en","revision_id":"2114363","source_text_sha256":"abd973af33222bc0d4bd7e734a544b6b7dcfac082ee940c9d8ddadccf3fd942b"},{"source_id":"fandom_sup_magic_pocket_realms_03","provider":"fandom","role":"primary","title":"Domain","url":"https://genshin-impact.fandom.com/wiki/Domain","language":"en","revision_id":"1806683","source_text_sha256":"e6f70a4a1aa9aa57c9a426030a1dc9e073837b7ac9ff857567712f54f9100742"},{"source_id":"fandom_sup_magic_pocket_realms_05","provider":"fandom","role":"primary","title":"Veluriyam Mirage","url":"https://genshin-impact.fandom.com/wiki/Veluriyam_Mirage","language":"en","revision_id":"1760436","source_text_sha256":"1f5d4b899e8aef2860d40c76cfad9ebff158de9bb4d3169e122ec631a3a65970"},{"source_id":"fandom_sup_magic_pocket_realms_06","provider":"fandom","role":"primary","title":"Simulanka","url":"https://genshin-impact.fandom.com/wiki/Simulanka","language":"en","revision_id":"1918272","source_text_sha256":"57653d905936f439d203b3eee59f0e550cd3c8cd376c8ced66ab48607ea0f913"},{"source_id":"local_sup_magic_pocket_realms_01","provider":"local_dialogue","role":"local_dialogue_verification","title":"艰厄得解谜境中","url":"local://YuanShenResources/CHS/Quest/Quest_40020.json#unit=4002010","language":"zh-CN","revision_id":"OSCBWin6.7.54","source_text_sha256":"21726f1a064ea7778cab6138deea9f3ab9ebe4ddb756c1d95dbb45e7539d4188"},{"source_id":"local_sup_magic_pocket_realms_03","provider":"local_dialogue","role":"local_dialogue_verification","title":"痴念虚错拂袖去","url":"local://YuanShenResources/CHS/Quest/Quest_40022.json#unit=4002203","language":"zh-CN","revision_id":"OSCBWin6.7.54","source_text_sha256":"5ab0d288ac6f384a852ddada1b3981412392bc1752e04a4feed6f9aca856b349"},{"source_id":"local_sup_magic_pocket_realms_04","provider":"local_dialogue","role":"local_dialogue_verification","title":"琉璃秘境，小中见大","url":"local://YuanShenResources/CHS/Quest/Quest_40113.json#unit=4011308","language":"zh-CN","revision_id":"OSCBWin6.7.54","source_text_sha256":"2f29c440a04416c6f6e25f90f628d303f69a556e3e7cb2146cfa0cbf4f9345b2"}],"evidence_bundle_sha256":"b29b25ff5b6a5eeddf55d9800e4d3ace2c59f53aca2678da77578dcc9050aace","review":{"cross_language_conflicts":[],"uncertain_claims":["触发诀箓阴阳寮异常复苏并开启大门的力量身份未知。","惟神晴之介废弃诀箓阴阳寮的原因及其后续去向没有被现有证据确定。","琉形蜃境的创造者、创造方法及其与外景的关系没有被现有证据确定。","希穆兰卡的具体创造方法、承载介质以及与秘境或外景的关系没有被现有证据确定。"],"missing_evidence":["现有来源没有建立外景、一般秘境、诀箓阴阳寮、琉形蜃境与希穆兰卡之间的统一分类、共用原理、从属关系或技术传承；因此目标词条目前只能作为多个独立现象的汇集卡。"],"needs_human_review":true}}