{"schema_version":"genshin-world-lore-card-v1","lore_id":"khaenriah_abyss_order","name_zh":"深渊教团的坎瑞亚起源","name_en":"Khaenri'ahn Origin of Abyss Order","aliases":["深渊教团的坎瑞亚起源","Khaenri'ahn Origin of Abyss Order"],"category":"organization","scope":"cross_regional","regions":["Khaenri'ah"],"summary":"深渊教团由坎瑞亚贵族克洛达尔·亚尔伯里奇在坎瑞亚灾变后创立。克洛达尔在为受诅咒的儿子卡利贝尔寻求救治时接触了坎瑞亚「五大罪人」之一的「预言家」维瑟弗尼尔，并将卡利贝尔恢复神智等现象视为深渊回应祈求的证明，由此转向崇信深渊。旅行者的血亲后来加入教团并成为其王子或公主。现有材料表明许多教团成员原本来自坎瑞亚，但不能据此断定全体成员皆为坎瑞亚人。","canonical_facts":[{"fact_id":"origin_founder","text":"深渊教团的创始人是克洛达尔·亚尔伯里奇；他出身坎瑞亚的亚尔伯里奇贵族家系。","status":"confirmed","temporal_scope":"坎瑞亚灾变后","visibility":"specialist_knowledge","source_ids":["fandom_khaenriah_abyss_order","fandom_sup_khaenriah_abyss_order_03","local_sup_khaenriah_abyss_order_01","local_sup_khaenriah_abyss_order_03"]},{"fact_id":"origin_curse_context","text":"坎瑞亚灾变期间，纯血坎瑞亚人克洛达尔受到不死诅咒；非纯血的儿子卡利贝尔则变成丘丘人并陷入失去神智的状态。这成为克洛达尔寻求救治及接触深渊力量的直接背景。","status":"confirmed","temporal_scope":"约五百年前的坎瑞亚灾变及其后不久","visibility":"secret_or_exceptional","source_ids":["fandom_khaenriah_abyss_order","fandom_sup_khaenriah_abyss_order_03"]},{"fact_id":"origin_vedrfolnir","text":"克洛达尔与旅行者的血亲寻找救治卡利贝尔的方法时接触了「预言家」维瑟弗尼尔。维瑟弗尼尔是坎瑞亚「五大罪人」之一，游戏内叙述将其称为引导克洛达尔创立深渊教团的人。","status":"confirmed","temporal_scope":"坎瑞亚灾变后、深渊教团成立前","visibility":"secret_or_exceptional","source_ids":["fandom_khaenriah_abyss_order","fandom_sup_khaenriah_abyss_order_03","local_sup_khaenriah_abyss_order_02"]},{"fact_id":"origin_chlothar_interpretation","text":"克洛达尔认为卡利贝尔恢复神智及其身上显现的力量证明深渊回应了自己的祈求，并由此得出「唯有罪人才能拯救罪人」以及掌控深渊即可掌控一切的结论；这是克洛达尔本人的认识与信仰，而非材料独立验证的普遍法则。","status":"reported","temporal_scope":"深渊教团成立前夕","visibility":"secret_or_exceptional","source_ids":["fandom_khaenriah_abyss_order","fandom_sup_khaenriah_abyss_order_03","local_sup_khaenriah_abyss_order_03"]},{"fact_id":"origin_loom_of_fate","text":"「命运的织机」这一概念在教团成立前后的源头叙事中已经出现：克洛达尔宣称卡利贝尔能够重新纺织自己的命运，并称他将成为「命运的织机」。","status":"confirmed","temporal_scope":"深渊教团成立前夕","visibility":"secret_or_exceptional","source_ids":["fandom_khaenriah_abyss_order","local_sup_khaenriah_abyss_order_01","local_sup_khaenriah_abyss_order_03"]},{"fact_id":"origin_sibling_leadership","text":"克洛达尔后来创立深渊教团，并使旅行者的血亲成为教团的王子或公主。血亲最初对克洛达尔崇信深渊的言行感到不安，但在完成自己的旅程后加入教团，并最终成为其领袖。","status":"confirmed","temporal_scope":"深渊教团成立后至今","visibility":"restricted_knowledge","source_ids":["fandom_khaenriah_abyss_order","fandom_sup_khaenriah_abyss_order_03"]},{"fact_id":"origin_membership_extent","text":"现有材料称许多、甚至可能全部教团成员原本来自受诅咒前的坎瑞亚，但教团的规模、成员构成、层级与力量程度均不明确，因此不能确认全体成员皆为坎瑞亚人。","status":"unknown","temporal_scope":"深渊教团成立后至今","visibility":"not_applicable","source_ids":["fandom_khaenriah_abyss_order"]},{"fact_id":"origin_hostility_explanation","text":"据戴因斯雷布所述，诸神毁灭坎瑞亚是深渊教团意图摧毁七神庇护诸国的原因。该因果解释属于戴因斯雷布的陈述。","status":"reported","temporal_scope":"深渊教团成立后至今","visibility":"restricted_knowledge","source_ids":["fandom_khaenriah_abyss_order"]},{"fact_id":"founder_later_disappearance","text":"克洛达尔创立深渊教团约百年后精神完全失常，随后下落不明。","status":"confirmed","temporal_scope":"深渊教团成立约百年后","visibility":"specialist_knowledge","source_ids":["fandom_sup_khaenriah_abyss_order_03","local_sup_khaenriah_abyss_order_01"]}],"timeline":[{"period":"约五百年前的坎瑞亚灾变","order_hint":10,"events":["坎瑞亚遭到毁灭，其居民受到诅咒；克洛达尔承受不死诅咒，卡利贝尔则变成丘丘人。"],"current_status":"灾变与诅咒构成深渊教团诞生的历史背景。","source_ids":["fandom_khaenriah_abyss_order","fandom_sup_khaenriah_abyss_order_03"]},{"period":"灾变后不久、教团成立前","order_hint":20,"events":["克洛达尔与旅行者的血亲为救治卡利贝尔而行动，并接触「预言家」维瑟弗尼尔。","卡利贝尔恢复神智及随后显现的深渊力量，使克洛达尔转而崇信深渊。","克洛达尔称卡利贝尔将成为「命运的织机」。"],"current_status":"这段经历被视为深渊教团及其「命运的织机」概念的开端。","source_ids":["fandom_khaenriah_abyss_order","fandom_sup_khaenriah_abyss_order_03","local_sup_khaenriah_abyss_order_01","local_sup_khaenriah_abyss_order_02","local_sup_khaenriah_abyss_order_03"]},{"period":"深渊教团成立时期","order_hint":30,"events":["克洛达尔创建深渊教团。","旅行者的血亲后来加入教团，并被尊为王子或公主。"],"current_status":"旅行者的血亲现为深渊教团领袖。","source_ids":["fandom_khaenriah_abyss_order","fandom_sup_khaenriah_abyss_order_03"]},{"period":"成立约百年后","order_hint":40,"events":["克洛达尔完全陷入疯狂，此后不知所踪。"],"current_status":"克洛达尔的最终结局仍未得到确认。","source_ids":["fandom_sup_khaenriah_abyss_order_03","local_sup_khaenriah_abyss_order_01"]}],"relationships":[],"in_world_visibility":{"public_summary":"提瓦特地表社会对深渊教团所知很少，较可能只知道它敌视七国、七神与地表文明；其由克洛达尔创立、维瑟弗尼尔参与其起源以及卡利贝尔与「命运的织机」概念之间的早期联系，均不属于普通知识。","likely_known_by":["旅行者","派蒙","戴因斯雷布","旅行者的血亲","深渊教团高层或接近其领袖的内圈成员"],"unlikely_known_by":["七国的普通居民","一般冒险者","不了解坎瑞亚灾变内情的地表人士"],"common_beliefs_or_misconceptions":["地表人士可能只将深渊教团理解为来自深渊的魔物军团，而不知道其创始人与坎瑞亚贵族及灾变诅咒之间的联系。","不能因大量成员与坎瑞亚有关，就断定所有智慧型深渊生物均属于深渊教团，或断定教团全体成员都是坎瑞亚人。"]},"activation_keys":["深渊教团的坎瑞亚起源","Khaenri'ahn Origin of Abyss Order"],"excluded_material":{"gameplay_only":[],"unsupported_or_speculative":["男性遗骨已被确定为克洛达尔，以及克洛达尔已确定摆脱不死诅咒；证据中前者是旅行者的判断，后者是戴因斯雷布提出的条件性推测。","深渊教团全体成员均为坎瑞亚人；主要来源明确保留了成员比例与构成未知。","根据克洛达尔姓名词源推断其必然是「命运的织机」计划设计者；该说法来自词源趣闻与编辑性联想。","BWiki关于教团已完成「最初的复国阶段」以及全体由被天理变成非人生物的坎瑞亚遗民组成的绝对化陈述；证据包中的Fandom正文或直接游戏文本未充分支持这些表述。"]},"sources":[{"source_id":"fandom_khaenriah_abyss_order","provider":"fandom","role":"primary","title":"Abyss Order","url":"https://genshin-impact.fandom.com/wiki/Abyss_Order","language":"en","revision_id":"2116087","source_text_sha256":"340186c8acbaa58c9b108645202d525f41b5479395c854ddd39c3a18cb962d68"},{"source_id":"bwiki_khaenriah_abyss_order","provider":"bwiki","role":"cross_language_verification","title":"深渊教团","url":"https://wiki.biligame.com/ys/%E6%B7%B1%E6%B8%8A%E6%95%99%E5%9B%A2","language":"zh-CN","revision_id":"631524","source_text_sha256":"966b327ddc70324e1532842a14a3fc6053afb6b922f6837c94a30670457f8e9c"},{"source_id":"fandom_sup_khaenriah_abyss_order_03","provider":"fandom","role":"primary","title":"Chlothar","url":"https://genshin-impact.fandom.com/wiki/Chlothar","language":"en","revision_id":"1966239","source_text_sha256":"c618c13d3e9bf7106728b731f3ea9be3e4dc6ac010f76c2210e0602d1a1148ef"},{"source_id":"local_sup_khaenriah_abyss_order_01","provider":"local_dialogue","role":"local_dialogue_verification","title":"既已写下的命运","url":"local://YuanShenResources/CHS/Quest/Quest_8012.json#unit=801213","language":"zh-CN","revision_id":"OSCBWin6.7.54","source_text_sha256":"cf321ae0386c2077af102c3ab0aeaea171f714e73e8ce1f9082424352efa2149"},{"source_id":"local_sup_khaenriah_abyss_order_02","provider":"local_dialogue","role":"local_dialogue_verification","title":"不应存在的记忆","url":"local://YuanShenResources/CHS/Quest/Quest_8020.json#unit=802009","language":"zh-CN","revision_id":"OSCBWin6.7.54","source_text_sha256":"f3790d1167a92483243884be33ab23b86f278e79f69e5919b2d4d886a63c6f4b"},{"source_id":"local_sup_khaenriah_abyss_order_03","provider":"local_dialogue","role":"local_dialogue_verification","title":"既已写下的命运","url":"local://YuanShenResources/CHS/Quest/Quest_8012.json#unit=801211","language":"zh-CN","revision_id":"OSCBWin6.7.54","source_text_sha256":"e23603eac548a892642a4c967ea4e0ee3c633b3404182b59dfa4ec3b35fb7c93"}],"evidence_bundle_sha256":"d26d883f40566c0c302203990394762a4eaabd7f59376735371568d7ca079318","review":{"cross_language_conflicts":["BWiki将创始人写作「克洛德尔·亚尔伯里奇」，而直接中文游戏文本及Fandom所列简体中文正式名均为「克洛达尔」；本卡采用直接游戏文本中的「克洛达尔·亚尔伯里奇」。","BWiki将教团绝对化描述为由坎瑞亚遗民变成的非人生物组成；Fandom则称许多、甚至可能全部成员原本来自坎瑞亚，同时明确指出成员构成未知。本卡保留主要来源中的不确定性。"],"uncertain_claims":["克洛达尔失踪后的最终下落，以及遗骨是否属于他、他是否确实摆脱不死诅咒，均未获确认。","教团成员中原坎瑞亚人的确切比例未知。","教团成立的精确时间，以及旅行者的血亲正式加入并取得领导地位的精确时间，现有材料仅能给出相对顺序。"],"missing_evidence":[],"needs_human_review":true}}