{"schema_version":"genshin-world-lore-card-v1","lore_id":"sumeru_wisdom_dreams","name_zh":"智慧观、梦境与知识社会","name_en":"Wisdom, Dreams and Knowledge","aliases":["智慧观、梦境与知识社会","Wisdom, Dreams and Knowledge"],"category":"culture","scope":"regional","regions":["Sumeru"],"summary":"Sumeru文化重视理性、智慧、学习与研究。Akasha System运行期间，知识被作为资源管理，成年人普遍借助终端获取信息；许多成年人不做梦，并以此为荣。系统暂停后，当地人重新能够做梦。知识也被视为财富与特权的尺度，并催生了绕过审核的Knowledge Capsules黑市。","canonical_facts":[{"fact_id":"fact_001","text":"在智慧之神的引导下，Sumeru文化主要围绕学习与研究展开；当地人普遍重视理性与智慧。","status":"confirmed","temporal_scope":"长期文化特征","visibility":"common_knowledge","source_ids":["fandom_sumeru_wisdom_dreams"]},{"fact_id":"fact_002","text":"Sumeru Akademiya被描述为Teyvat已知规模最大的学术中心，许多关于Sumeru的社会认知都以该机构为背景。","status":"confirmed","temporal_scope":"证据所述时期","visibility":"regional_knowledge","source_ids":["fandom_sumeru_wisdom_dreams"]},{"fact_id":"fact_003","text":"Akasha System运行期间，知识被作为一种资源加以管理；该系统由前任Dendro Archon的Gnosis供能。","status":"confirmed","temporal_scope":"Akasha System暂停前","visibility":"specialist_knowledge","source_ids":["fandom_sumeru_wisdom_dreams"]},{"fact_id":"fact_004","text":"Akasha System暂停前，Sumeru人经常使用Akasha Terminals查找信息，几乎每名成年人都有终端，而儿童没有。","status":"confirmed","temporal_scope":"Akasha System暂停前","visibility":"common_knowledge","source_ids":["fandom_sumeru_wisdom_dreams"]},{"fact_id":"fact_005","text":"Akasha System暂停前，许多Sumeru成年人不做梦；当地社会将这种现象视为值得自豪之事。","status":"confirmed","temporal_scope":"Akasha System暂停前","visibility":"common_knowledge","source_ids":["fandom_sumeru_wisdom_dreams"]},{"fact_id":"fact_006","text":"Akasha System暂停后，Sumeru人重新能够做梦。","status":"confirmed","temporal_scope":"Akasha System暂停后","visibility":"common_knowledge","source_ids":["fandom_sumeru_wisdom_dreams"]},{"fact_id":"fact_007","text":"知识在Sumeru通常同时被视为财富和特权的衡量尺度；当地存在Knowledge Capsules黑市，使使用者无需事先审核即可接触其中的知识，购买者常包括Akademiya研究者。","status":"confirmed","temporal_scope":"证据所述时期","visibility":"regional_knowledge","source_ids":["fandom_sumeru_wisdom_dreams"]},{"fact_id":"fact_008","text":"Sumeru Akademiya虽享誉Teyvat，但学业可能持续极长时间。","status":"confirmed","temporal_scope":"证据所述时期","visibility":"regional_knowledge","source_ids":["fandom_sumeru_wisdom_dreams"]},{"fact_id":"fact_009","text":"一名曾在Sumeru Akademiya就读的人将其描述为具有工作狂文化，并称这使自己在离开后对学院的生活方式感到幻灭。","status":"reported","temporal_scope":"该人物回顾其求学经历时","visibility":"regional_knowledge","source_ids":["fandom_sumeru_wisdom_dreams"]}],"timeline":[{"period":"Akasha System运行时期","order_hint":1,"events":["知识由Akasha System作为资源管理，成年人广泛使用Akasha Terminals获取信息。","许多成年人不做梦，并把这种状态视为值得自豪之事。"],"current_status":"该社会状态已随Akasha System暂停而结束。","source_ids":["fandom_sumeru_wisdom_dreams"]},{"period":"Akasha System暂停后","order_hint":2,"events":["Akasha System被暂停。","Sumeru人重新能够做梦。"],"current_status":"证据所述现状为Akasha System已经暂停，居民能够再次做梦。","source_ids":["fandom_sumeru_wisdom_dreams"]}],"relationships":[],"in_world_visibility":{"public_summary":"Sumeru居民普遍了解当地社会对理性、智慧、学习和研究的重视，也经历过Akasha Terminals的广泛使用及系统暂停后梦境恢复的变化。知识与财富、特权之间的联系以及Knowledge Capsules交易，则更可能因群体和经历不同而有不同程度的了解。","likely_known_by":["Sumeru成年居民","Sumeru Akademiya的学生与研究者","Akasha Terminals的既往使用者","Knowledge Capsules交易参与者"],"unlikely_known_by":["未曾配发Akasha Terminal的儿童对系统实际使用方式的亲历性知识","未接触Knowledge Capsules交易者对黑市具体运作的详细知识"],"common_beliefs_or_misconceptions":["Akasha System暂停前，成年人不做梦曾被许多当地人视为值得自豪之事。"]},"activation_keys":["智慧观、梦境与知识社会","Wisdom, Dreams and Knowledge"],"excluded_material":{"gameplay_only":["角色卡外形、卡面符号与相关图库展示。","敌人分级、敌人图标、掉落材料及材料图标。"],"unsupported_or_speculative":["把雨林地区的免费医疗推定为必然通过法律扩展至沙漠居民。","对匿名留言作者身份及其学业将持续十五至二十年的推算。","对部分徽记中动物形象具体种类的编辑者猜测。","由Pursina反推祖先姓名及性别的推测。","对Shaggy Sumpter Beasts能够衡量财富之原因的推测。"]},"sources":[{"source_id":"fandom_sumeru_wisdom_dreams","provider":"fandom","role":"primary","title":"Sumeru/Culture","url":"https://genshin-impact.fandom.com/wiki/Sumeru/Culture","language":"en","revision_id":"2071389","source_text_sha256":"64a296c64b40dee64b962a6b4240b0b4d73fa0d6a9147905299c1ef28b8f283c"}],"evidence_bundle_sha256":"f3f1ab1234ee0c06f34b7e5745a11e0db4eaa5d590baae41c4958ac5aa8c2057","review":{"cross_language_conflicts":[],"uncertain_claims":["证据只称许多成年人不做梦，不能扩展为所有成年人都不做梦。","证据未说明Akasha System暂停的准确时间，也未交代其知识管理职能是否由其他制度接替。"],"missing_evidence":["证据包未提供BWiki中文核验页，因此未自行补写Akasha System、Akasha Terminals、Knowledge Capsules、Sumeru Akademiya、Teyvat、Dendro Archon和Gnosis的中文正式名。","来源元数据标记有一行禁用来源内容已被移除；该内容未出现在证据正文中，也未被本卡使用。"],"needs_human_review":false}}