{"schema_version":"genshin-world-lore-card-v1","lore_id":"institution_seven_sovereigns","name_zh":"七龙王","name_en":"Seven Sovereigns","aliases":["七龙王","Seven Sovereigns"],"category":"institution","scope":"global","regions":[],"summary":"七龙王是光界七位处于原始元素生命顶点的龙，原本分别持有一种元素大权并统治旧世界。天理建立新秩序时击败七王并夺走部分大权；原初七王力量衰退后，新一代龙王陆续诞生，但现存龙王通常无法取回完整力量与旧世界记忆。现有证据明确支持阿佩普、那维莱特与修库特尔的成员身份；特瓦林与若陀龙王的归类仍依赖 Wiki 编辑推断。","canonical_facts":[{"fact_id":"seven_sovereigns_fact_01","text":"渊下宫文本称龙蜥界是纯粹、原始的元素生物世界，书名为「光界」；光界的七王是代表蛮荒、原始元素力之顶的「元素七龙」。","status":"confirmed","temporal_scope":"跨时代","visibility":"specialist_knowledge","source_ids":["local_sup_institution_seven_sovereigns_01"]},{"fact_id":"seven_sovereigns_fact_02","text":"七龙王是光界最强大的七位元素生命，每一位分别驾驭一种原始元素。","status":"confirmed","temporal_scope":"跨时代","visibility":"specialist_knowledge","source_ids":["fandom_sup_institution_seven_sovereigns_01","local_sup_institution_seven_sovereigns_01"]},{"fact_id":"seven_sovereigns_fact_03","text":"原初七龙王与尼伯龙根共同统治旧世界及其七个国度；七王各持有一种元素大权和一部分世界，其领地与对应元素相适应。","status":"confirmed","temporal_scope":"旧世界时期","visibility":"secret_or_exceptional","source_ids":["fandom_institution_seven_sovereigns","fandom_sup_institution_seven_sovereigns_01","bwiki_institution_seven_sovereigns"]},{"fact_id":"seven_sovereigns_fact_04","text":"天理到来后与七龙王交战并将其击败，夺取其大权、建立适合人类的新秩序；部分拒绝屈服者逃往海洋深处。","status":"confirmed","temporal_scope":"天理建立新秩序之时","visibility":"secret_or_exceptional","source_ids":["fandom_institution_seven_sovereigns","fandom_sup_institution_seven_sovereigns_01"]},{"fact_id":"seven_sovereigns_fact_05","text":"被夺走的元素大权后来成为诸神神座力量的基础；对应神座被摧毁并归还大权以前，现存龙王无法使用完整力量，也无法取回完整的旧世界记忆。","status":"confirmed","temporal_scope":"新秩序建立后至今","visibility":"secret_or_exceptional","source_ids":["fandom_institution_seven_sovereigns","fandom_sup_institution_seven_sovereigns_01"]},{"fact_id":"seven_sovereigns_fact_06","text":"随着原初七龙王的力量衰退，新一代龙王正在诞生；龙王只能由元素性质纯粹的龙诞生，也可能以人形重生。","status":"confirmed","temporal_scope":"原初七王衰退后","visibility":"secret_or_exceptional","source_ids":["fandom_institution_seven_sovereigns","fandom_sup_institution_seven_sovereigns_01"]},{"fact_id":"seven_sovereigns_fact_07","text":"主要来源将阿佩普、那维莱特和修库特尔分别列为草、水、火元素对应的七龙王成员；阿佩普与那维莱特仍存活，修库特尔已经死亡，那维莱特是以人形存在的新一代水元素成员。","status":"confirmed","temporal_scope":"现时代","visibility":"specialist_knowledge","source_ids":["fandom_institution_seven_sovereigns","fandom_sup_institution_seven_sovereigns_01","bwiki_institution_seven_sovereigns","local_sup_institution_seven_sovereigns_03"]},{"fact_id":"seven_sovereigns_fact_08","text":"芙卡洛斯摧毁水神神座并归还力量后，那维莱特成为完全状态的元素龙王，获得对水元素的绝对掌控力；截至现有证据，这是已明确完全恢复大权的七龙王成员。","status":"confirmed","temporal_scope":"枫丹灾难结束后","visibility":"secret_or_exceptional","source_ids":["fandom_institution_seven_sovereigns","fandom_sup_institution_seven_sovereigns_01","local_sup_institution_seven_sovereigns_03"]},{"fact_id":"seven_sovereigns_fact_09","text":"Fandom 正文将特瓦林与若陀龙王分别归为风、岩元素对应的现存龙王，但其注释显示这些归类来自称谓用法、同类并列及其他间接线索，而非所引游戏文本的直接宣告。","status":"reported","temporal_scope":"现时代","visibility":"specialist_knowledge","source_ids":["fandom_institution_seven_sovereigns","fandom_sup_institution_seven_sovereigns_01","bwiki_institution_seven_sovereigns"]}],"timeline":[{"period":"旧世界时期","order_hint":10,"events":["七龙王与尼伯龙根共同统治旧世界，各自持有一种元素大权和一部分世界。"],"current_status":"这一原初统治秩序已经终结。","source_ids":["fandom_institution_seven_sovereigns","fandom_sup_institution_seven_sovereigns_01"]},{"period":"天理建立新秩序之时","order_hint":20,"events":["天理与七龙王交战并将其击败，夺走其大权，随后重塑世界并建立人界。"],"current_status":"七龙王失去原有统治地位，其部分大权后来与诸神神座相连。","source_ids":["fandom_institution_seven_sovereigns","fandom_sup_institution_seven_sovereigns_01"]},{"period":"新世界早期","order_hint":30,"events":["尼伯龙根携深渊力量返回后，沉睡的龙王苏醒并参加针对天理的复仇战争，但未能夺回力量。","战争结束后，七龙王的部分元素大权被用于创造七枚神之心，随后出现了七个新的神座。"],"current_status":"旧世界秩序未能复辟，七龙王的大权继续被新秩序分割。","source_ids":["fandom_institution_seven_sovereigns","fandom_sup_institution_seven_sovereigns_01"]},{"period":"原初七王力量衰退后","order_hint":40,"events":["新一代龙王开始诞生，其中龙王可能以人形重生。"],"current_status":"现存成员包含原初龙王与继任者，但证据没有给出七个元素全部成员的完整、直接确认名单。","source_ids":["fandom_institution_seven_sovereigns","fandom_sup_institution_seven_sovereigns_01"]},{"period":"枫丹灾难结束后","order_hint":50,"events":["水神神座被摧毁，水元素大权归还那维莱特，使其成为完全状态的元素龙王。"],"current_status":"水元素对应成员已恢复完整大权；其他现存成员仍未被证明已全部恢复。","source_ids":["fandom_institution_seven_sovereigns","fandom_sup_institution_seven_sovereigns_01","local_sup_institution_seven_sovereigns_03"]}],"relationships":[],"in_world_visibility":{"public_summary":"七龙王的存在及其作为光界元素生命顶点的性质见于渊下宫相关知识；其远古统治、大权被夺及继承机制属于少数古老文献、龙王本人或重大事件亲历者才可能掌握的知识。","likely_known_by":["阿祇等了解渊下宫文献者","现存七龙王成员","那维莱特及枫丹事件真相的少数知情者","亲历龙王讲述或相关重大事件者"],"unlikely_known_by":["缺乏古代文献渠道的普通提瓦特居民","仅知道地方龙类传说而不了解旧世界秩序者"],"common_beliefs_or_misconceptions":[]},"activation_keys":["七龙王","Seven Sovereigns"],"excluded_material":{"gameplay_only":[],"unsupported_or_speculative":["Fandom 所列非正史分支结局。","将卡帕奇莉认定为雷元素对应龙王的说法；BWiki 自身标注存疑，且主要来源与直接游戏文本均未支持。","把特瓦林或若陀龙王的成员身份提升为游戏文本直接确认的结论。","在缺少可核验双语对应文本时，将英文别称 elemental dragon sovereigns 或 elemental dragons 擅自指定为某一中文正式译名。"]},"sources":[{"source_id":"fandom_institution_seven_sovereigns","provider":"fandom","role":"primary","title":"Seven Sovereigns","url":"https://genshin-impact.fandom.com/wiki/Seven_Sovereigns","language":"en","revision_id":"2128181","source_text_sha256":"4a3f3e45317815c66565dbd1541038e068c36766fc0ef882a60e52dd02f6af2a"},{"source_id":"bwiki_institution_seven_sovereigns","provider":"bwiki","role":"cross_language_verification","title":"七龙王","url":"https://wiki.biligame.com/ys/%E4%B8%83%E9%BE%99%E7%8E%8B","language":"zh-CN","revision_id":"666230","source_text_sha256":"9b5c383072aa1ceb19a0cf1e047008195072dccbc459337dd696c251619fb67f"},{"source_id":"fandom_sup_institution_seven_sovereigns_01","provider":"fandom","role":"primary","title":"Seven Sovereigns","url":"https://genshin-impact.fandom.com/wiki/Seven_Sovereigns","language":"en","revision_id":"2128181","source_text_sha256":"04c59ee315241ac81333d5058fd129219edb54260e60884ab56d344b64149314"},{"source_id":"local_sup_institution_seven_sovereigns_01","provider":"local_dialogue","role":"local_dialogue_verification","title":"三界路飨祭·前夜","url":"local://YuanShenResources/CHS/Quest/Quest_40047.json#unit=4004705","language":"zh-CN","revision_id":"OSCBWin6.7.54","source_text_sha256":"9a981f8d890e585479ff36be6e14a9ff6ec27f7195797c65648ff810453237de"},{"source_id":"local_sup_institution_seven_sovereigns_03","provider":"local_dialogue","role":"local_dialogue_verification","title":"终幕礼","url":"local://YuanShenResources/CHS/Quest/Quest_4025.json#unit=402509","language":"zh-CN","revision_id":"OSCBWin6.7.54","source_text_sha256":"4372586f8a14f36dc1a6e7aa521b2356b56db990e474a14bf299b0710f0c1a8e"}],"evidence_bundle_sha256":"827ee5dddb11667948da40ed8f985d940bccbe47cb310dd60f6b45965830263d","review":{"cross_language_conflicts":["Fandom 的语言表将 Seven Sovereigns 的简体中文正式名列为「七王」，而目标与 BWiki 页名使用「七龙王」；直接中文游戏文本出现的是「光界的七王」「元素七龙」及单数语境中的「元素龙王」，证据包没有提供 Seven Sovereigns 与「七龙王」逐句对应的双语文本。"],"uncertain_claims":["特瓦林为风元素对应龙王、若陀龙王为岩元素对应龙王的归类，在 Fandom 中包含编辑者依据术语和同类并列所作的推断，尚未获得证据包内直接游戏文本的明确宣告。","英文别称 elemental dragon sovereigns、elemental dragons 与中文「元素龙王」「元素七龙」之间的正式逐项对应关系尚未核实。"],"missing_evidence":["缺少直接游戏文本或非推断性的主要来源，明确宣告特瓦林与若陀龙王分别为风、岩元素对应的七龙王成员。","缺少主要来源或直接游戏文本明确说明雷、冰元素对应龙王的身份。","缺少可精确配对的中英游戏文本，用于核定 Seven Sovereigns 及其英文别称对应的正式中文名称。"],"needs_human_review":true}}