{"schema_version":"genshin-world-lore-card-v1","lore_id":"fontaine_grand_symphony","name_zh":"大乐章、福波斯与命运","name_en":"Grand Symphony, Phobos and Fortuna","aliases":["大乐章、福波斯与命运","Grand Symphony, Phobos and Fortuna"],"category":"power_system","scope":"regional","regions":["Fontaine"],"summary":"雷穆斯为使雷穆利亚摆脱被称为命运（Fortuna）的毁灭预言，构建了能够传遍全境的大乐章。福波斯与这套大乐章紧密关联，但现有中英文证据对二者是完全同义，还是系统与核心对象的关系，表述并不一致。雷穆斯最后交给斯库拉的「安魂曲」是令福波斯自毁的命令，原计划借此解放被置入顽石身躯的臣民；计划遭到波爱修斯干预，并最终与雷穆利亚的覆灭相连。","canonical_facts":[{"fact_id":"fgs_fact_01","text":"《雷穆利亚衰亡史》记载，预言者宣告雷穆利亚将遭受最彻底的毁灭，并将这一注定结局称为命运（Fortuna）；雷穆利亚士兵也把挣脱 Fortuna 的枷锁解释为反抗命运本身。","status":"reported","temporal_scope":"雷穆斯统治时期及其后世历史记述","visibility":"regional_knowledge","source_ids":["fandom_sup_fontaine_grand_symphony_02","fandom_sup_fontaine_grand_symphony_03"]},{"fact_id":"fgs_fact_02","text":"为了逃避命运的裁决，雷穆斯制定原初计划并谱写繁荣的和谐乐章；黄金宫殿本身是用于演奏大乐章的巨大乐器，乐章曾通过从宫殿延伸的水道传播至雷穆利亚全境。","status":"confirmed","temporal_scope":"雷穆利亚建立、繁荣及衰落时期","visibility":"specialist_knowledge","source_ids":["fandom_sup_fontaine_grand_symphony_03","local_sup_fontaine_grand_symphony_04"]},{"fact_id":"fgs_fact_03","text":"福波斯是大乐章自毁计划中的核心对象。英文 Fandom 的雷穆利亚条目以 Phobos 指称 Grand Symphony，而中文任务文本则称「安魂曲」是使「福波斯」自毁的命令，并分别提到演奏大乐章与掌握福波斯的力量；现有证据无法确定二者是否严格同义。","status":"disputed","temporal_scope":"雷穆利亚时期至相关力量残留的后世","visibility":"specialist_knowledge","source_ids":["fandom_fontaine_grand_symphony","local_sup_fontaine_grand_symphony_02","local_sup_fontaine_grand_symphony_04"]},{"fact_id":"fgs_fact_04","text":"雷穆斯最后交给斯库拉的「乐章」又称「安魂曲」，其内容是令福波斯自毁；让斯库拉率领龙蜥大军进攻王城，也是这一秘密计划的一部分。","status":"confirmed","temporal_scope":"雷穆利亚覆灭前夕","visibility":"secret_or_exceptional","source_ids":["fandom_fontaine_grand_symphony","local_sup_fontaine_grand_symphony_01","local_sup_fontaine_grand_symphony_02"]},{"fact_id":"fgs_fact_05","text":"据斯库拉说明，雷穆斯计划以自身牺牲释放乐章的力量，再由斯库拉控制被唤醒的原初蛮荒之力，使臣民脱离顽石身躯、恢复血肉，并消除人为制造的种族隔阂；雷穆斯要求该计划不得向臣民公开。","status":"reported","temporal_scope":"雷穆利亚覆灭前夕的秘密计划","visibility":"secret_or_exceptional","source_ids":["local_sup_fontaine_grand_symphony_02"]},{"fact_id":"fgs_fact_06","text":"秘密计划遭到波爱修斯的干预，斯库拉未能及时抵达黄金宫殿并遭到封印。大乐章的自毁命令引发海啸，雷穆利亚及其居民由此沉没，原定的解放计划未能按预期完成。","status":"confirmed","temporal_scope":"雷穆利亚覆灭之日","visibility":"specialist_knowledge","source_ids":["fandom_fontaine_grand_symphony","local_sup_fontaine_grand_symphony_01","local_sup_fontaine_grand_symphony_02"]},{"fact_id":"fgs_fact_07","text":"数千年后，雷穆斯及乐章的力量仍有残留；据呜斯先生与斯库拉所述，波爱修斯已逐步掌握部分福波斯之力，而尚存的安魂曲仍可能解放被困于雕像中的雷穆利亚灵魂，使其回归高海与生死循环。","status":"reported","temporal_scope":"雷穆利亚覆灭数千年后","visibility":"secret_or_exceptional","source_ids":["local_sup_fontaine_grand_symphony_02","local_sup_fontaine_grand_symphony_04"]}],"timeline":[{"period":"毁灭预言与大乐章的建立","order_hint":1,"events":["预言者将雷穆利亚注定遭受的彻底毁灭称为命运（Fortuna）。","雷穆斯为逃避命运的裁决谱写和谐乐章，并建立将旋律传遍全境的宫殿与水道系统。"],"current_status":"大乐章成为雷穆斯维持雷穆利亚秩序并反抗预言的核心手段。","source_ids":["fandom_sup_fontaine_grand_symphony_03","local_sup_fontaine_grand_symphony_04"]},{"period":"雷穆利亚覆灭前夕","order_hint":2,"events":["雷穆斯将最后的「安魂曲」交给斯库拉，其内容是令福波斯自毁。","雷穆斯秘密安排斯库拉率军进攻王城，并计划由斯库拉控制福波斯自毁后唤醒的力量。"],"current_status":"计划仅向少数参与者公开，普通臣民并不知道进攻王城的真实目的。","source_ids":["fandom_fontaine_grand_symphony","local_sup_fontaine_grand_symphony_01","local_sup_fontaine_grand_symphony_02"]},{"period":"雷穆利亚覆灭之日","order_hint":3,"events":["波爱修斯干预秘密计划并封印斯库拉，使其未能及时抵达黄金宫殿。","大乐章的自毁命令引发海啸，雷穆利亚及其居民沉入水下。"],"current_status":"安魂曲原定的解放计划未能完成，众多雷穆利亚灵魂继续受困。","source_ids":["fandom_fontaine_grand_symphony","local_sup_fontaine_grand_symphony_01","local_sup_fontaine_grand_symphony_02"]},{"period":"覆灭数千年后","order_hint":4,"events":["斯库拉的灵魂重获自由，并试图重新完成雷穆斯的遗愿。","波爱修斯被指已逐渐掌握部分福波斯之力，安魂曲则仍保有解放被困灵魂的潜力。"],"current_status":"福波斯与大乐章仍以残留力量影响旧日遗迹；安魂曲能否及如何完成原计划，现有证据只给出了斯库拉的说明。","source_ids":["local_sup_fontaine_grand_symphony_02","local_sup_fontaine_grand_symphony_04"]}],"relationships":[],"in_world_visibility":{"public_summary":"当代公众最多可能知道雷穆利亚曾试图以宏大的乐章反抗毁灭命运，但其历史在灾难后迅速被传说、迷信和人为歪曲所遮蔽。安魂曲、福波斯自毁命令及斯库拉进攻王城的真实目的属于极少数人掌握的秘密。","likely_known_by":["雷穆斯与斯库拉等秘密计划参与者","曾接触大乐章或福波斯的雷穆利亚高层","研究雷穆利亚遗迹与史料的学者","仍保留相关记忆的雷穆利亚灵魂"],"unlikely_known_by":["未被告知秘密计划的普通雷穆利亚臣民","缺乏雷穆利亚专门知识的当代普通民众"],"common_beliefs_or_misconceptions":["斯库拉曾被视为背叛雷穆利亚并进攻王城的敌人；斯库拉则声称此次进攻本就是雷穆斯的秘密安排。","雷穆利亚覆灭后的公开历史混杂着传说、迷信及自称其后裔者的有意歪曲。","把大乐章与福波斯简单视为完全同义，可能忽略中文任务文本中「乐章命令福波斯自毁」的区分性表述。"]},"activation_keys":["大乐章、福波斯与命运","Grand Symphony, Phobos and Fortuna"],"excluded_material":{"gameplay_only":["任务步骤、战斗波次、交涉信任值及解谜机制","成就、任务奖励与攻略提示","玩家对话选项、条件分支及可选抚摸互动"],"unsupported_or_speculative":["未采信派蒙关于靠近演奏中的宫殿会被震散的玩笑。","未确定波爱修斯对福波斯的具体控制程度与控制机制。","未将同名的 golden Fortuna 帝国船与本卡所指的命运概念直接等同。","未把安魂曲预期恢复血肉及消除隔阂的结果视为已经实际发生。"]},"sources":[{"source_id":"fandom_fontaine_grand_symphony","provider":"fandom","role":"primary","title":"Remuria","url":"https://genshin-impact.fandom.com/wiki/Remuria","language":"en","revision_id":"2071184","source_text_sha256":"82fb750d89064c7b6ebc1d3c470f9bc4b9a536bdda97303f68e2c936f7ab1631"},{"source_id":"fandom_sup_fontaine_grand_symphony_02","provider":"fandom","role":"primary","title":"The Last Day of Remuria","url":"https://genshin-impact.fandom.com/wiki/The_Last_Day_of_Remuria","language":"en","revision_id":"2066952","source_text_sha256":"c3e4778da071696cef83c3ea75db8ea28eb56e691b79bafe377088aa4619928f"},{"source_id":"fandom_sup_fontaine_grand_symphony_03","provider":"fandom","role":"primary","title":"The History of the Decline and Fall of Remuria","url":"https://genshin-impact.fandom.com/wiki/The_History_of_the_Decline_and_Fall_of_Remuria","language":"en","revision_id":"2130590","source_text_sha256":"dc6b494bc9bbc190860f2fa447c2ea393164a0693758bf1c40dbf758dd105364"},{"source_id":"local_sup_fontaine_grand_symphony_01","provider":"local_dialogue","role":"local_dialogue_verification","title":"雷穆利亚的最后一日","url":"local://YuanShenResources/CHS/Quest/Quest_74183.json#unit=7418306","language":"zh-CN","revision_id":"OSCBWin6.7.54","source_text_sha256":"cf7be0a1747c784d219e75947b00f9b848e952af95f6ec2dcb32313940127346"},{"source_id":"local_sup_fontaine_grand_symphony_02","provider":"local_dialogue","role":"local_dialogue_verification","title":"通往卡皮托林的阶梯","url":"local://YuanShenResources/CHS/Quest/Quest_74194.json#unit=7419417","language":"zh-CN","revision_id":"OSCBWin6.7.54","source_text_sha256":"20373237c01a6ff43732475a342041165ae9bd50295af9354980b30b9d835a72"},{"source_id":"local_sup_fontaine_grand_symphony_04","provider":"local_dialogue","role":"local_dialogue_verification","title":"通往卡皮托林的阶梯","url":"local://YuanShenResources/CHS/Quest/Quest_74194.json#unit=7419402","language":"zh-CN","revision_id":"OSCBWin6.7.54","source_text_sha256":"a44bec7b3271acac569f8f934ba4fc57e3118974524daadaf17c6b86746430b2"}],"evidence_bundle_sha256":"bcca244e05b29ab1796cab958de6b2cbb26d04947016f1bec9be51d448eadb1a","review":{"cross_language_conflicts":["英文 Fandom 的雷穆利亚条目以 Phobos 指称 Grand Symphony；中文直接对话则把「乐章」表述为使「福波斯」自毁的命令，并分别谈论大乐章与福波斯之力。两者构成概念边界上的跨语言歧义，尚不能确认是完全同义还是系统与核心对象的关系。"],"uncertain_claims":["雷穆斯以安魂曲恢复臣民血肉并消除人为种族隔阂的效果，来自斯库拉对秘密计划的说明，属于计划目标而非已验证结果。","波爱修斯逐步掌握福波斯力量的程度仅有呜斯先生的概括性说法。","覆灭数千年后以安魂曲释放灵魂、使其回归生死循环的可行性来自斯库拉的判断。"],"missing_evidence":["缺少直接、明确说明「大乐章」与「福波斯」本体关系的中文文本，无法判定二者是同一名称、整体与核心，还是命令系统与承载对象。"],"needs_human_review":true}}