{"schema_version":"genshin-world-lore-card-v1","lore_id":"natlan_postwar_state","name_zh":"战后纳塔","name_en":"Postwar Natlan","aliases":["战后纳塔","Postwar Natlan"],"category":"history","scope":"regional","regions":["Natlan"],"summary":"深渊战争结束后，夜神之国中的深渊影响被肃清，其地脉规则又因「队长」的牺牲而得到强化与改写，外来者的灵魂此后也能被夜神之国接纳。Fandom记载纳塔人已可离境且不再承受此前的后果，但又称Mualani提到仍需征得部族首领许可；由于证据包没有相应的战后游戏内直接对话，现行许可的性质与持续期限仍不明确。","canonical_facts":[{"fact_id":"natlan_postwar_state_fact_01","text":"深渊战争期间，纳塔人的生存与Wayob紧密相连；Wayob在境外提供保护的能力有限，离境者可能出现记忆缺失和情绪问题，因此离境者过去必须由部族首领向Wayob申请许可。","status":"confirmed","temporal_scope":"深渊影响被肃清以前","visibility":"common_knowledge","source_ids":["fandom_natlan_postwar_state"]},{"fact_id":"natlan_postwar_state_fact_02","text":"深渊入侵期间，玛薇卡曾考虑将纳塔人转移到其他国家避难，但因夜神之国与纳塔人联系紧密，强行离开纳塔的后果过于沉重而未将其视为适宜方案。","status":"confirmed","temporal_scope":"深渊战争期间","visibility":"restricted_knowledge","source_ids":["local_sup_natlan_postwar_state_01"]},{"fact_id":"natlan_postwar_state_fact_03","text":"Gosoythoth被消灭后，夜神之国中的深渊影响得到肃清；战争结束后，Lord of the Night返回其中维持地脉。","status":"confirmed","temporal_scope":"深渊战争结束时及其后","visibility":"specialist_knowledge","source_ids":["fandom_sup_natlan_postwar_state_03"]},{"fact_id":"natlan_postwar_state_fact_04","text":"「队长」以自己的死亡替代玛薇卡原计划付出的死亡，并将生命力与Lord of the Night融合，从而强化并改写地脉规则；此后，纳塔以外之人的灵魂也能被夜神之国接纳。","status":"confirmed","temporal_scope":"深渊战争结束后","visibility":"secret_or_exceptional","source_ids":["fandom_sup_natlan_postwar_state_03"]},{"fact_id":"natlan_postwar_state_fact_05","text":"Fandom的Natlan页面记载：夜神之国的深渊影响被肃清后，过去限制纳塔人离境的规则不再适用，纳塔人能够自行离境而不再承受此前的后果。证据包没有提供直接支持这一战后变化的游戏内对话。","status":"reported","temporal_scope":"深渊战争结束后","visibility":"regional_knowledge","source_ids":["fandom_natlan_postwar_state"]},{"fact_id":"natlan_postwar_state_fact_06","text":"Fandom的Natlan页面称，Mualani提到离境仍需征得部族首领许可；但该页面关于这种许可只是过渡性礼节、未来可能消失的说法属于编辑性推测，不能确认为事实。","status":"reported","temporal_scope":"深渊战争结束后","visibility":"regional_knowledge","source_ids":["fandom_natlan_postwar_state"]},{"fact_id":"natlan_postwar_state_fact_07","text":"战后部族首领许可究竟是强制规则、一般行政程序还是社会礼节，以及该要求会持续多久，现有正文证据均无法确定。","status":"unknown","temporal_scope":"当前战后时期","visibility":"not_applicable","source_ids":["fandom_natlan_postwar_state"]}],"timeline":[{"period":"深渊影响被肃清以前","order_hint":10,"events":["纳塔人的生存与Wayob相连，而Wayob的境外保护能力有限；离境可能造成记忆及情绪问题。","离境者必须由部族首领向Wayob申请许可；深渊入侵期间，玛薇卡也因强行离境后果严重而未采用跨国疏散方案。"],"current_status":"这些条件构成战后离境状态发生变化前的基准。","source_ids":["fandom_natlan_postwar_state","local_sup_natlan_postwar_state_01"]},{"period":"深渊战争结束时","order_hint":20,"events":["Gosoythoth被消灭，夜神之国中的深渊影响得到肃清。","Lord of the Night返回夜神之国维持地脉。","「队长」牺牲后，其生命力被用于强化并改写地脉规则，外来者的灵魂从此也能被夜神之国接纳。"],"current_status":"夜神之国摆脱深渊侵蚀，并以改写后的地脉规则继续运作。","source_ids":["fandom_sup_natlan_postwar_state_03"]},{"period":"战后当前时期","order_hint":30,"events":["Fandom的Natlan页面记载，纳塔人现可离境且不再承受过去的后果。","同一页面又称Mualani提到仍需取得部族首领许可，但未提供相应的直接对话。"],"current_status":"离境造成的旧有后果据报已经消失，但部族首领许可是否仍属强制要求及其具体性质尚未得到直接文本确认。","source_ids":["fandom_natlan_postwar_state"]}],"relationships":[],"in_world_visibility":{"public_summary":"纳塔民众过去普遍了解离境风险及Wayob许可程序。战后实际离境条件可能通过日常实践为当地人所知，但现有证据没有说明规则变更是否已被正式公开，也没有说明普通民众是否了解地脉规则被改写的具体机制。","likely_known_by":["玛薇卡与各部族首领","处理夜神之国及地脉事务的知情者","纳塔民众（至少普遍了解战前离境风险与许可程序）"],"unlikely_known_by":["不熟悉纳塔内部情况的外国普通民众","未被告知夜神之国与地脉变化细节的人"],"common_beliefs_or_misconceptions":["不能将战后仍需部族首领许可视为已经证实的纯粹礼节，也不能断定该程序必然会随时间消失。"]},"activation_keys":["战后纳塔","Postwar Natlan"],"excluded_material":{"gameplay_only":["Natlan页面中的探索机制、战斗能力、元素技能、夜魂值、燃素计量、环境伤害、操作方式、敌人机制、宝箱、供奉奖励和任务攻略信息。","Night Kingdom页面中关于开放世界可用性、任务副本、实例与地方传奇入口的玩家视角说明。"],"unsupported_or_speculative":["部族首领许可只是沿袭旧制的过渡性礼节。","部族首领许可会随着时间推移而消失。","在缺少战后直接对话的情况下，将离境后果消失及许可程序的具体适用范围扩展到证据未说明的所有情形。"]},"sources":[{"source_id":"fandom_natlan_postwar_state","provider":"fandom","role":"primary","title":"Natlan","url":"https://genshin-impact.fandom.com/wiki/Natlan","language":"en","revision_id":"2135331","source_text_sha256":"a59de712d340c8a6ec549689b09b5ccdc440a201a3d0a48a270c5b889bfa98ef"},{"source_id":"fandom_sup_natlan_postwar_state_03","provider":"fandom","role":"primary","title":"Night Kingdom","url":"https://genshin-impact.fandom.com/wiki/Night_Kingdom","language":"en","revision_id":"2115456","source_text_sha256":"d8ac6f11c753e5c5b231aa07ee26cc037171a8bd79afa1443bf23f12a594fbfa"},{"source_id":"local_sup_natlan_postwar_state_01","provider":"local_dialogue","role":"local_dialogue_verification","title":"摇曳灯火一分为二","url":"local://YuanShenResources/CHS/Quest/Quest_5017.json#unit=501703","language":"zh-CN","revision_id":"OSCBWin6.7.54","source_text_sha256":"69d34299dc1c4a579d68f1690d1cf165ae56b4bbe754b948d4201ce8bdf9b5a4"}],"evidence_bundle_sha256":"6dd3d12328bb7d829017973ff0853986f12d0842b7acae41232fb771961d1a04","review":{"cross_language_conflicts":[],"uncertain_claims":["纳塔人战后离境已不再产生记忆缺失、情绪问题或其他旧有后果，目前仅有Fandom概述正文支持，缺少战后游戏内直接对话。","Mualani所述战后仍需部族首领许可的原始语境未包含在证据包中。","许可属于强制规则、行政程序还是礼节，以及是否会逐渐取消，均未确定。"],"missing_evidence":["缺少深渊影响被肃清后，直接说明纳塔人离境后果如何变化及其适用范围的游戏内文本。","缺少Mualani关于战后仍需取得部族首领许可的直接对话，因而无法确认该要求的性质、程序与持续期限。"],"needs_human_review":true}}