{"schema_version":"genshin-world-lore-card-v1","lore_id":"natlan_ochkanatlan","name_zh":"奥奇卡纳塔","name_en":"Ochkanatlan","aliases":["奥奇卡纳塔","Ochkanatlan"],"category":"geography","scope":"regional","regions":["Natlan"],"summary":"奥奇卡纳塔是纳塔的一处古城遗迹区域，也曾是奥奇坎统治的同名古代文明所在地。城市建立在更古老的龙族城市废墟上，奥奇坎被推翻后遭废弃，并长期受到深渊侵蚀、怪物和古代机关盘踞；如今它被纳塔部族视为禁地，却仍因天蛇船及其宝藏传说吸引冒险者。","canonical_facts":[{"fact_id":"fact_001","text":"奥奇卡纳塔是纳塔的一处区域，现状为古老城墟；同名亦指曾存在于此、由奥奇坎统治的古代文明。","status":"confirmed","temporal_scope":"古代至现今","visibility":"regional_knowledge","source_ids":["fandom_natlan_ochkanatlan","fandom_sup_natlan_ochkanatlan_01","fandom_sup_natlan_ochkanatlan_02","local_sup_natlan_ochkanatlan_01"]},{"fact_id":"fact_002","text":"奥奇卡纳塔约在两千年前由 Xbalanque 的追随者建立在 Chichen Uctokah 的废墟之上，奥奇坎后来成为其国王。","status":"confirmed","temporal_scope":"约两千年前","visibility":"specialist_knowledge","source_ids":["fandom_sup_natlan_ochkanatlan_02","fandom_sup_natlan_ochkanatlan_08"]},{"fact_id":"fact_003","text":"奥奇坎夺取了原龙族统治者 Ixlel 的权柄，将其囚禁在 Old Core of Chu'ulel；他又以自身的龙族部分制造了一个受其控制的新 Core of Chu'ulel，后者一度为整座城市供能。","status":"confirmed","temporal_scope":"奥奇坎统治时期","visibility":"secret_or_exceptional","source_ids":["fandom_sup_natlan_ochkanatlan_01","fandom_sup_natlan_ochkanatlan_02","fandom_sup_natlan_ochkanatlan_04","fandom_sup_natlan_ochkanatlan_08"]},{"fact_id":"fact_004","text":"奥奇卡纳塔遗迹包含中央城堡式建筑、地表聚落遗迹、岛屿、地下洞窟与多层地下房室，并有一艘位于空中的古老船只托纳蒂乌，即当地传说中的天蛇船。","status":"confirmed","temporal_scope":"现存地貌","visibility":"regional_knowledge","source_ids":["fandom_sup_natlan_ochkanatlan_01","local_sup_natlan_ochkanatlan_01"]},{"fact_id":"fact_005","text":"奥奇坎被推翻后，奥奇卡纳塔遭到废弃并被视为受诅咒之地；其原有统治权随后归还纳塔诸部族。证据只能确认这种历史评价，不能确认城市是否存在独立且持续生效的超自然诅咒。","status":"confirmed","temporal_scope":"奥奇坎被推翻后至现今","visibility":"regional_knowledge","source_ids":["fandom_sup_natlan_ochkanatlan_02","fandom_sup_natlan_ochkanatlan_08"]},{"fact_id":"fact_006","text":"大灾变前，Kukulkan 将奥奇坎的肉身变成深渊力量的导体；至大灾变后的早期，奥奇卡纳塔已经受到深渊能量侵染，并有深渊怪物、丘丘人及奥奇坎受污染的肉身出没。","status":"confirmed","temporal_scope":"大灾变前至大灾变后早期","visibility":"secret_or_exceptional","source_ids":["fandom_sup_natlan_ochkanatlan_02","fandom_sup_natlan_ochkanatlan_05","fandom_sup_natlan_ochkanatlan_08","local_sup_natlan_ochkanatlan_03"]},{"fact_id":"fact_007","text":"现今遗迹中分布着怪物、古代供能机关及多种 Khaenri'ah 遗迹机械，也有野生动物、龙类生物和植物在不同区域栖息。","status":"confirmed","temporal_scope":"现今","visibility":"regional_knowledge","source_ids":["fandom_sup_natlan_ochkanatlan_02","fandom_sup_natlan_ochkanatlan_07"]},{"fact_id":"fact_008","text":"奥奇卡纳塔如今是部族禁止进入的区域，并由花羽会飞行队定期监视。奥奇卡纳塔冒险队仅有一人逃回后，城市成为部族禁地；另有 Saurian Relics Association 调查队失踪，使该组织此后回避与此地有关的事务。","status":"confirmed","temporal_scope":"大灾变后至现今","visibility":"regional_knowledge","source_ids":["fandom_sup_natlan_ochkanatlan_02","fandom_sup_natlan_ochkanatlan_07","local_sup_natlan_ochkanatlan_01"]},{"fact_id":"fact_009","text":"关于托纳蒂乌的建造者存在来源冲突：玻娜称它是奥奇坎建造的天船；Fandom 地理正文则称它原由龙族建造，后来才由奥奇坎改造。","status":"disputed","temporal_scope":"古代","visibility":"specialist_knowledge","source_ids":["fandom_sup_natlan_ochkanatlan_01","local_sup_natlan_ochkanatlan_01"]},{"fact_id":"fact_010","text":"托纳蒂乌满载宝物的传说并非可靠史实，而是 Kukulkan 刻意传播的诱饵，用来吸引冒险者进入奥奇卡纳塔，以供其进行实验并吞噬灵魂。","status":"confirmed","temporal_scope":"大灾变前后延续至现今事件发生前","visibility":"secret_or_exceptional","source_ids":["fandom_sup_natlan_ochkanatlan_01","fandom_sup_natlan_ochkanatlan_02","fandom_sup_natlan_ochkanatlan_08"]},{"fact_id":"fact_011","text":"纳塔冒险者之间流传着一种说法：天蛇船上的「回还之玉」能够镇压遭深渊侵染的奥奇卡纳塔。证据仅确认该说法曾被相信，并未证明这种镇压能力确实存在。","status":"reported","temporal_scope":"大灾变后","visibility":"regional_knowledge","source_ids":["fandom_sup_natlan_ochkanatlan_07","local_sup_natlan_ochkanatlan_01"]},{"fact_id":"fact_012","text":"旅行者到访后击败了复苏的奥奇坎，并取得此前被称为「回还之玉」的通牒金盘；奥奇坎称由深渊侵蚀造成的噩梦已经结束。旅行者之后也解除了囚禁 Ixlel 意识的束缚，使其意志消散。","status":"confirmed","temporal_scope":"现今，旅行者到访后","visibility":"secret_or_exceptional","source_ids":["fandom_sup_natlan_ochkanatlan_04","fandom_sup_natlan_ochkanatlan_08","local_sup_natlan_ochkanatlan_03"]}],"timeline":[{"period":"约两千年前","order_hint":10,"events":["Xbalanque 的追随者在 Chichen Uctokah 的废墟上建立奥奇卡纳塔。","奥奇坎取得王位，并以新 Core of Chu'ulel 为城市供能。"],"current_status":"奥奇卡纳塔由古龙族城市遗址转变为人类帝国的都城。","source_ids":["fandom_sup_natlan_ochkanatlan_02","fandom_sup_natlan_ochkanatlan_08"]},{"period":"奥奇坎统治末期","order_hint":20,"events":["奥奇坎被 Scarlet-Eyed Youth 及其同伴推翻。","奥奇坎分离神智与肉身；城市随后遭废弃并被视为受诅咒之地。"],"current_status":"奥奇卡纳塔失去政治中心地位，成为废弃城墟。","source_ids":["fandom_sup_natlan_ochkanatlan_02","fandom_sup_natlan_ochkanatlan_08"]},{"period":"大灾变之前","order_hint":30,"events":["Kukulkan 将奥奇坎的肉身改造成深渊力量的导体。","Kukulkan 散布托纳蒂乌藏有大量宝物的传说，以引诱冒险者进入遗迹。"],"current_status":"奥奇卡纳塔逐渐成为受深渊侵染的陷阱和危险遗迹。","source_ids":["fandom_sup_natlan_ochkanatlan_01","fandom_sup_natlan_ochkanatlan_02","fandom_sup_natlan_ochkanatlan_08"]},{"period":"约四百九十年前及其后数十年","order_hint":40,"events":["奥奇卡纳塔冒险队为寻找能够对抗深渊的宝物进入遗迹，最终几乎全军覆没。","队长之女玻娜后来沿同一路线进入奥奇卡纳塔，也遭遇相同敌人并身亡。"],"current_status":"城市被部族列为禁地，宝藏传说与冒险队覆灭的故事继续流传。","source_ids":["fandom_sup_natlan_ochkanatlan_02","fandom_sup_natlan_ochkanatlan_05","fandom_sup_natlan_ochkanatlan_08","local_sup_natlan_ochkanatlan_01"]},{"period":"现今，旅行者到访","order_hint":50,"events":["旅行者在玻娜之灵与奥奇坎神智所化同伴的协助下抵达托纳蒂乌。","旅行者击败与肉身重新结合后复苏的奥奇坎，取得被称为「回还之玉」的通牒金盘。","旅行者解除囚禁 Ixlel 意识的锁链，使其结束长达数千年的折磨。"],"current_status":"奥奇坎受深渊操纵造成的威胁已经终止，Ixlel 的意志也已消散；遗迹内其他怪物、机关及禁地管控是否发生整体变化，证据未作说明。","source_ids":["fandom_sup_natlan_ochkanatlan_04","fandom_sup_natlan_ochkanatlan_08","local_sup_natlan_ochkanatlan_03"]}],"relationships":[],"in_world_visibility":{"public_summary":"纳塔部族普遍将奥奇卡纳塔视作危险、受诅咒且禁止进入的古城遗迹；民间与冒险者群体还流传天蛇船满载宝物，以及「回还之玉」能够镇压深渊污秽的故事。","likely_known_by":["纳塔各部族成员","负责巡查遗迹的花羽会飞行队","追逐天蛇船传说的纳塔冒险者","曾调查古代遗迹的 Saurian Relics Association","亲历现今事件的旅行者、派蒙及其同行者"],"unlikely_known_by":["缺乏纳塔古代史知识的普通外地人","不了解奥奇卡纳塔内幕的普通部族成员","不知道 Kukulkan 与宝藏诱饵真相的人"],"common_beliefs_or_misconceptions":["托纳蒂乌满载真实宝藏；该传说实际由 Kukulkan 有意散布。","「回还之玉」能够镇压奥奇卡纳塔的深渊污秽；现有证据只证明这是流传的说法。","奥奇卡纳塔被称为受诅咒之城，但证据未明确证明存在独立于深渊侵蚀和怪物危害之外的超自然诅咒。"]},"activation_keys":["奥奇卡纳塔","Ochkanatlan"],"excluded_material":{"gameplay_only":["地图页面所列的子区域和兴趣点数量。","版本发布、地图扩展及与其他地图区域接壤的更新记录。","向王座供奉矿石、旅行者元素状态、共鸣等级和命座奖励。","任务开启条件、任务步骤、敌人数量、宝箱、成就、传送点、解谜操作及探索指引。","原声曲目编号、播放地点和专辑信息。"],"unsupported_or_speculative":["地名由 Och-Kan 与 Natlan 拼合而成的词源推测。","所有出现在现今奥奇卡纳塔的人类必然都是过去显现或潜入后遇害者的 Wiki 推论。","奥奇卡纳塔存在独立且客观生效的超自然诅咒。","「回还之玉」确实具有镇压深渊侵染的能力。"]},"sources":[{"source_id":"fandom_natlan_ochkanatlan","provider":"fandom","role":"primary","title":"Ochkanatlan","url":"https://genshin-impact.fandom.com/wiki/Ochkanatlan","language":"en","revision_id":"2074316","source_text_sha256":"21ce1fdecb27a8dbfd100aa54baddc473870706009586de050150f95df73cc32"},{"source_id":"fandom_sup_natlan_ochkanatlan_01","provider":"fandom","role":"primary","title":"Ochkanatlan","url":"https://genshin-impact.fandom.com/wiki/Ochkanatlan","language":"en","revision_id":"2074316","source_text_sha256":"476fd6c8f80441bb805a06be03c2d64398c03c05b788cccf910307721b45687c"},{"source_id":"fandom_sup_natlan_ochkanatlan_02","provider":"fandom","role":"primary","title":"Ochkanatlan","url":"https://genshin-impact.fandom.com/wiki/Ochkanatlan_(Civilization)","language":"en","revision_id":"1888228","source_text_sha256":"efd011be151d4396304475ae9c3f61934d3e4883483dfee191251de3d9df044f"},{"source_id":"fandom_sup_natlan_ochkanatlan_04","provider":"fandom","role":"primary","title":"Open Your Heart to Me","url":"https://genshin-impact.fandom.com/wiki/Open_Your_Heart_to_Me","language":"en","revision_id":"2074250","source_text_sha256":"32ff615ff922a1cf548116d40b9aa2d00b5506a49ad1701518e594a8766aa7a6"},{"source_id":"fandom_sup_natlan_ochkanatlan_05","provider":"fandom","role":"primary","title":"Twisted Extension","url":"https://genshin-impact.fandom.com/wiki/Twisted_Extension","language":"en","revision_id":"1807447","source_text_sha256":"15092198549a738a9125a31399cab7959e075715d145c210b667459e36e54af1"},{"source_id":"fandom_sup_natlan_ochkanatlan_07","provider":"fandom","role":"primary","title":"Loading Screen/Natlan","url":"https://genshin-impact.fandom.com/wiki/Loading_Screen/Natlan","language":"en","revision_id":"2072230","source_text_sha256":"8eaddae996c48f261d250e2449a9469bbe124b33f425b8c7af857752d4d001c0"},{"source_id":"fandom_sup_natlan_ochkanatlan_08","provider":"fandom","role":"primary","title":"Natlan/History","url":"https://genshin-impact.fandom.com/wiki/Natlan/History","language":"en","revision_id":"2110901","source_text_sha256":"0c50215baf3bf255adbe515d0b21258cc7f79ef555ff70970577ef1fad2d93db"},{"source_id":"local_sup_natlan_ochkanatlan_01","provider":"local_dialogue","role":"local_dialogue_verification","title":"翻越朝霭之墙","url":"local://YuanShenResources/CHS/Quest/Quest_75048.json#unit=7504816","language":"zh-CN","revision_id":"OSCBWin6.7.54","source_text_sha256":"8b740819e776e5f5bfa993d892c9bd8dfe92797803c0f5564bd4502b269530ad"},{"source_id":"local_sup_natlan_ochkanatlan_03","provider":"local_dialogue","role":"local_dialogue_verification","title":"梦醒时分","url":"local://YuanShenResources/CHS/Quest/Quest_75137.json#unit=7513703","language":"zh-CN","revision_id":"OSCBWin6.7.54","source_text_sha256":"e81cb6ca8f0bd78ad6291a4a983d819773ddbdb79d4e3fc0464eb3bc85d47c45"}],"evidence_bundle_sha256":"460b5a26f6998c2ead2fe20760394ee16cba111cb217b613e4ccfa0fb9a1df45","review":{"cross_language_conflicts":["关于托纳蒂乌的建造来源，中文游戏对话中玻娜称其为奥奇坎所建造；英文 Fandom 地理正文称其由龙族建造、后经奥奇坎改造。现有证据不足以消解该差异。"],"uncertain_claims":["「回还之玉」是否确实能够镇压奥奇卡纳塔的深渊侵染仍未得到证明。","奥奇卡纳塔被称为受诅咒之城，但所谓诅咒是否只是对深渊侵蚀、怪物和失踪事件的概括仍不明确。","现今遗迹中是否存在长期常住的人类，以及旅行者到访后部族是否调整禁入管控，证据均未说明。"],"missing_evidence":["BWiki 的奥奇卡纳塔中文核验页不存在，导致 Chichen Uctokah、Core of Chu'ulel、Ixlel、Kukulkan 等专名缺少可用的中文正式名核验；本卡因此保留英文原名。"],"needs_human_review":true}}