{"schema_version":"genshin-world-lore-card-v1","lore_id":"nodkrai_voynich","name_zh":"沃伊尼奇商会","name_en":"Voynich Guild","aliases":["沃伊尼奇商会","Voynich Guild"],"category":"organization","scope":"regional","regions":["Nod-Krai"],"summary":"沃伊尼奇商会是以 Nasha Town 为基地、由当地商人组成的商业公会，也是 Nod-Krai 最有影响力的势力之一。它承担当地近似贸易监管机构的职能，管理贸易、进出口、商业认证及纠纷调查与处理等事务。","canonical_facts":[{"fact_id":"voynich_fact_001","text":"沃伊尼奇商会以 Nasha Town 为基地，成员由当地商人组成，是 Nod-Krai 最有影响力的势力之一。","status":"confirmed","temporal_scope":"证据所述当前时期","visibility":"regional_knowledge","source_ids":["fandom_nodkrai_voynich"]},{"fact_id":"voynich_fact_002","text":"沃伊尼奇商会是 Nod-Krai 当地最接近监管权威的组织，但现有证据没有将其明确界定为正式政府机关。","status":"confirmed","temporal_scope":"证据所述当前时期","visibility":"regional_knowledge","source_ids":["fandom_nodkrai_voynich"]},{"fact_id":"voynich_fact_003","text":"商会负责管理各类贸易交易、货物进出口、商业证书签发，以及贸易纠纷的调查与解决。","status":"confirmed","temporal_scope":"证据所述当前时期","visibility":"regional_knowledge","source_ids":["fandom_nodkrai_voynich"]},{"fact_id":"voynich_fact_004","text":"商会似乎也参与某些技术的开发，但证据未明确说明其具体项目、权限或参与方式。","status":"reported","temporal_scope":"证据所述当前时期","visibility":"specialist_knowledge","source_ids":["fandom_nodkrai_voynich"]}],"timeline":[],"relationships":[],"in_world_visibility":{"public_summary":"Nod-Krai 当地居民尤其是商人，可能知道沃伊尼奇商会负责贸易管理、商业认证及纠纷处理；其技术开发活动的具体情况未必广为人知。","likely_known_by":["Nod-Krai 的当地商人","在 Nasha Town 从事商业活动者","申请商业证书者","当地贸易纠纷的相关方"],"unlikely_known_by":["远离 Nod-Krai 且未参与当地贸易者"],"common_beliefs_or_misconceptions":[]},"activation_keys":["沃伊尼奇商会","Voynich Guild"],"excluded_material":{"gameplay_only":[],"unsupported_or_speculative":["沃伊尼奇商会是 Nod-Krai 的正式政府或法定监管机关。","沃伊尼奇商会所开发技术的具体种类、项目与用途。"]},"sources":[{"source_id":"fandom_nodkrai_voynich","provider":"fandom","role":"primary","title":"Voynich Guild","url":"https://genshin-impact.fandom.com/wiki/Voynich_Guild","language":"en","revision_id":"2048294","source_text_sha256":"66270c9440ef7834f441a9bc94239148d1ffb6f245b2ed0b93f26b5f7db6677a"}],"evidence_bundle_sha256":"71aedb3866f417b2394a143edc3decbc29d50b09ef3dd31329c4d51b1088545f","review":{"cross_language_conflicts":[],"uncertain_claims":["Fandom 对商会参与技术开发使用了推测性措辞，现有证据不足以确认其具体情况。"],"missing_evidence":["BWiki 的“沃伊尼奇商会”核验页返回 missingtitle，无法核对 Nasha Town、Nod-Krai 等专名的中文正式写法，因此予以保留英文。"],"needs_human_review":true}}