{"schema_version":"genshin-world-lore-card-v1","lore_id":"natlan_ode_resurrection","name_zh":"还魂诗","name_en":"Ode of Resurrection","aliases":["还魂诗","Ode of Resurrection","Rite of Resurrection"],"category":"power_system","scope":"regional","regions":["Natlan"],"summary":"还魂诗是曾在 Natlan 举行的复生仪式，主要使在 Night Warden Wars 中对抗 Abyss 而死亡、且满足胜利条件的 Ancient Name 持有者复生。仪式一度失效，后来其祝福被临时扩展至所有 Natlan 战士；Night Wars 结束后，仪式已停办。","canonical_facts":[{"fact_id":"ode_fact_001","text":"还魂诗在 Natlan 的 Stadium of the Sacred Flame 举行，用于使在 Night Warden Wars 中对抗 Abyss 而死亡的 Ancient Name 持有者复生。","status":"confirmed","temporal_scope":"Night Wars 结束前的常规用途","visibility":"regional_knowledge","source_ids":["fandom_natlan_ode_resurrection"]},{"fact_id":"ode_fact_002","text":"复生对象必须已经“取得胜利”，即其所在队伍至少有一名成员胜利归来。","status":"confirmed","temporal_scope":"仪式正常运作期间","visibility":"regional_knowledge","source_ids":["fandom_natlan_ode_resurrection"]},{"fact_id":"ode_fact_003","text":"还魂诗的疗愈力量只处理致命伤，不会治愈同一场战斗中较早受到的其他伤势，也不会消除既有伤病。","status":"confirmed","temporal_scope":"仪式正常运作期间","visibility":"specialist_knowledge","source_ids":["fandom_natlan_ode_resurrection"]},{"fact_id":"ode_fact_004","text":"仪式以主持者诵读悼词开始；随后 Pyro Archon 进入 Sacred Flame，在 Night Kingdom 中寻找死者及其 Ancient Name，与会者则低头致意并歌唱。成功时，Pyro Archon 会与复生者一同从 Sacred Flame 中出现。","status":"confirmed","temporal_scope":"仪式正常运作期间","visibility":"regional_knowledge","source_ids":["fandom_natlan_ode_resurrection"]},{"fact_id":"ode_fact_005","text":"Kachina 的复生仪式失败后，Mavuika 私下表示，Night Kingdom 中由 Abyss 引发的动乱使她无法找到 Kachina；在问题解决前，还魂诗会继续失败。","status":"reported","temporal_scope":"Kachina 复生失败后的危机期间","visibility":"restricted_knowledge","source_ids":["fandom_natlan_ode_resurrection"]},{"fact_id":"ode_fact_006","text":"在 Abyssal invasion 期间集齐六名 Heroes of Natlan 后，Mavuika 曾借助 Lord of the Night 的力量，暂时将还魂诗的祝福扩展至所有 Natlan 战士，不论其是否持有 Ancient Name。此后伤亡人数事实上降至零。","status":"confirmed","temporal_scope":"Abyssal invasion 期间的临时扩展","visibility":"regional_knowledge","source_ids":["fandom_natlan_ode_resurrection"]},{"fact_id":"ode_fact_007","text":"最终进攻期间 Sacred Flame 一度衰弱；Kachina 自发举行还魂诗，将 Natlan 人的精神支持传递给作战者，使火焰重新获得力量，并解锁了 Traveler 的 Ancient Name 所对应的 Nightsoul's Blessing。","status":"confirmed","temporal_scope":"对 Night Kingdom 中 Abyss 发起最终进攻期间","visibility":"regional_knowledge","source_ids":["fandom_natlan_ode_resurrection"]},{"fact_id":"ode_fact_008","text":"Night Wars 结束后，由于战士不再被派往 Night Kingdom 对抗 Abyss，还魂诗仪式被停办。","status":"confirmed","temporal_scope":"Night Wars 结束后至证据叙述末端","visibility":"regional_knowledge","source_ids":["fandom_natlan_ode_resurrection"]}],"timeline":[{"period":"Kachina 的复生仪式失败时","order_hint":10,"events":["Mavuika 独自从 Sacred Flame 中返回，并报告无法在 Night Kingdom 找到 Kachina 或她的 Ancient Name。","群众中出现关于 Kachina 是否有资格获选的猜测；Mavuika 驳斥了这一说法，并宣告 Kachina 是英雄。","Mavuika 暂停 Pilgrimage，并对复生失败展开调查；她随后向少数人说明，Abyss 在 Night Kingdom 引发的动乱会使还魂诗继续失败。"],"current_status":"还魂诗处于持续失效风险中，Pilgrimage 因复生无法得到保障而暂停。","source_ids":["fandom_natlan_ode_resurrection"]},{"period":"Abyssal invasion 期间集齐六名 Heroes of Natlan 后","order_hint":20,"events":["Mavuika 暂时借助 Lord of the Night 的力量，将还魂诗的祝福扩展到所有 Natlan 战士，包括没有 Ancient Name 的人。","祝福扩展后，Natlan 战士的伤亡人数事实上降至零。"],"current_status":"还魂诗的适用范围获得临时扩展。","source_ids":["fandom_natlan_ode_resurrection"]},{"period":"对 Abyss 的最终进攻期间","order_hint":30,"events":["Sacred Flame 一度衰弱，Kachina 自发举行还魂诗，将 Natlan 人的精神支持传递给作战者。","仪式使 Sacred Flame 重新获得力量，并解锁 Traveler 的 Ancient Name 所对应的 Nightsoul's Blessing。"],"current_status":"还魂诗除复生功能外，也在危急时刻被用于汇聚并传递精神支持。","source_ids":["fandom_natlan_ode_resurrection"]},{"period":"Night Wars 结束后","order_hint":40,"events":["战士不再被派往 Night Kingdom 对抗 Abyss，还魂诗仪式随之停办。"],"current_status":"截至证据叙述末端，还魂诗已停办。","source_ids":["fandom_natlan_ode_resurrection"]}],"relationships":[],"in_world_visibility":{"public_summary":"Natlan 民众可能普遍知道还魂诗是为阵亡英雄举行的复生仪式，并可在 Stadium of the Sacred Flame 集体参与歌唱。Kachina 的仪式失败及 Mavuika 对其英雄身份的公开维护也曾被现场群众见证；失败的具体原因最初只向少数人说明。","likely_known_by":["Natlan 民众","参加仪式的群众","Ancient Name 持有者及参与 Night Warden Wars 的战士","Pyro Archon 与仪式主持者","Traveler、Paimon、Mualani、Iansan、Chasca、Kinich"],"unlikely_known_by":[],"common_beliefs_or_misconceptions":["Kachina 的复生失败曾引发她或许没有资格获选的群众猜测，但 Mavuika 明确驳斥了这一说法，并称她为英雄。"]},"activation_keys":["还魂诗","Ode of Resurrection"],"excluded_material":{"gameplay_only":[],"unsupported_or_speculative":["Kachina 因不具备资格而无法复生的群众猜测。","无法复生战士必将导致 Natlan 陷落于 Abyss 的危机判断，未作为已经发生的事实记录。"]},"sources":[{"source_id":"fandom_natlan_ode_resurrection","provider":"fandom","role":"primary","title":"Ode of Resurrection","url":"https://genshin-impact.fandom.com/wiki/Ode_of_Resurrection","language":"en","revision_id":"2066066","source_text_sha256":"32e97228a022bf92972be85ebe4a26cc5b8557ed86d2f80e037c76936691bbbc"}],"evidence_bundle_sha256":"7351c095fc29174f4cc132f28f1c052c22c1116b3ce7a8337100676833f6b609","review":{"cross_language_conflicts":[],"uncertain_claims":["Kachina 复生失败的原因来自 Mavuika 对少数人的说明，因此以 reported 而非 confirmed 记录。"],"missing_evidence":["BWiki 的“还魂诗”核验页返回 missingtitle，未能取得中文核验材料；因此无法从本证据包确认 Rite of Resurrection 等英文别名对应的正式中文译名。"],"needs_human_review":true}}